{
  "seeds_dr_id": "SEEDS-DR-001",
  "decision_context": "Existing digital health system assessment",
  "system_or_solution": "Patient Portal",
  "stakeholder_role": "Patient/common user",
  "sustainability_concern": "Essential health-service information may be difficult to understand for users with different levels of digital literacy.",
  "seeds_dimensions": ["Individual", "Social"],
  "related_criteria": ["Usability", "Accessibility", "Transparency"],
  "expected_effect": "First-order individual and social effects ensuring equitable health information access and reduced cognitive burden.",
  "derived_nfr_or_decision": "The system shall present essential health-service information in plain language and accessible formats.",
  "acceptance_criterion": "Representative users shall be able to complete key information-seeking tasks without assistance; critical information shall be reviewed for plain-language adequacy.",
  "verification_evidence": ["Usability test report", "Accessibility audit", "Readability review"],
  "trade_offs": "Plain language must preserve clinical accuracy, legal clarity, and institutional responsibility.",
  "decision_status": "Requires human review",
  "human_review_notes": "Draft generated by LLM agent workflow (Section 7). Pending validation with patient representatives and communication specialists."
}
